{
  "$schema": "../../schemas/domain.schema.json",
  "description": "www subdomain",
  "domain": "is-a.co",
  "subdomain": "www",
  "owner": {
    "repo": "https://github.com/pythonicboa/is-a.co"
  },
  "record": {
    "A": [
      "192.0.2.1"
    ],
    "AAAA": [
      "100::"
    ]
  }
}
